utt_id,topic,wer_baseline,wer_topic,delta_wer,ref,hyp_baseline,hyp_topic
Sh-NYbDcUug_1__4573a439_00_000000_000329,Cooking/Food,91.7,113.9,-22.2,close parentheses to type it in and then once i've finished typing that in you'll see the word hello displayed in our preview window pretty cool right pretty simple all that stuff is great now what,person to do it they'd be like i don't want to feel like i'm eating a sandwich that was made in a perfect room with perfect air conditioning perfect temperature now,person to do it so that's what i'm going to be doing for the next 15 minutes or so and then we're going to get out of here because i don't want to be here any longer than i have to now
KpcnLIhd47Q_10__6cfe1034_01_000250_000314,Other,100.0,125.0,-25.0,tension new developments every,physical and emotional,the speaker is discussing other
-7tusOdq-Aw_9__433c1e07_00_000000_000075,Business/Finance,90.9,127.3,-36.4,the 25 most important people to the growth of your business,the one that i'm most proud of is this one,so what's the point of all this let me tell you what the point is
oOcLf4qcoG4_0__a55c5024_00_000000_000091,Other,38.5,92.3,-53.8,or you can actually bring the pro controller with you on the go,to actually bring the broken dollar with you on the go,the speaker is discussing other
j9EUO6q-C3g_0__9c4dd2e3_00_000000_000148,Cooking/Food,100.0,188.9,-88.9,teaspoon of baking soda and salt you may say,beethoven sonata and it's going to take you about 15,the speaker is discussing cooking food recognize this song and it's got a lot of humor in it
XkBLBlF4TYo_1__995a8ace_00_000000_000360,Cooking/Food,92.7,197.6,-104.9,see a little mix in on the backside you can see on the backside of our system we're going to see a little wintery weather so tuesday is an all day downpour cold rain actually maybe enough to even cause flood,a little mixed on the back side it's like the bad side versus the good side one zero one two zero three zero four zero five zero six zero seven zero eight zero nine zero ten zero eleven zero twelve,a little mixed on the backside it's like the bad side versus the good side one zero one two zero three zero four zero five zero six zero seven zero eight zero nine zero a zero b zero c zero d zero e zero f zero g zero h zero i zero j zero k zero l zero m zero n zero o zero p zero q zero r zero s zero t zero u zero v zero w zero x zero y zero z zero
