utt_id,display_name,ref,hyp,hyp_tagged,wer_%,wwer_%,nea_recall_%,nea_precision_%,nea_f1_%,missed_entities
-r0CnHLAm2k_0__70eb4d5d_00_000000_000093,-r0CnHLAm2k_0__70eb4d5d,there forever and i want it to be a five star review,forever and i wanted to be around for you,forever:rep and:rep i:rep wanted:ins to:rep be:rep around:ins for:ins you:ins,58.3,68.4,0.0,100.0,0.0,five
0fmc81KXbB0_0__8be49586_00_000000_000099,0fmc81KXbB0_0__8be49586,i don't want to say mistakes but i will say like experiments and,i don't want to seem disrespectful,i:ok don't:ok want:ok to:ok seem:ins disrespectful:ins,69.2,78.9,25.0,33.3,28.6,"experiments, mistakes, say"
0v2N6w4m46s_0__964e9355_00_000000_000359,0v2N6w4m46s_0__964e9355 - Part 1,on today's the doctor is in the topic is hypertension there is no ideal blood pressure reading but there is an accepted range of normal readings and today we're going to see where ours specifically mine falls and whether or not you need to make some life decisions,today as the doctor says the topic is hypertension there is no ideal blood pressure reading but there is an accepted range of normal readings and today we'll see where our specifically mine falls and whether or not you're going to make some life changes,today:rep as:ins the:ok doctor:ok says:ins the:rep topic:rep is:rep hypertension:rep there:rep is:rep no:rep ideal:rep blood:rep pressure:rep reading:rep but:rep there:rep is:rep an:rep accepted:rep range:rep of:rep normal:rep readings:rep and:rep today:rep we'll:ins see:rep where:rep our:ins specifically:rep mine:rep falls:rep and:rep whether:rep or:rep not:rep you're:ins going:rep to:rep make:rep some:rep life:rep changes:ins,22.9,19.5,100.0,100.0,100.0,
0v2N6w4m46s_0__964e9355_01_000299_000395,0v2N6w4m46s_0__964e9355 - Part 2,and whether or not you need to make some lifestyle changes dr axel,and whether or not you're going to make some lifestyle changes not your hair,and:ok whether:ok or:ok not:ok you're:ins going:ins to:ok make:ok some:ok lifestyle:ok changes:ok not:rep your:ins hair:ins,38.5,47.8,0.0,100.0,0.0,"axel, dr"
1wZuiC0RuPM_13__dd2295eb_00_000000_000169,1wZuiC0RuPM_13__dd2295eb,you can just stitch that into place and that way it won't slide out,the tradition is to teach it in the place and that way it won't slide out,the:ins tradition:ins is:ins to:ins teach:ins it:rep in:ins the:ins place:rep and:rep that:rep way:rep it:rep won't:rep slide:rep out:rep,57.1,50.0,60.0,60.0,60.0,"just, stitch"
1whXJLCrTjY_0__668dbcdc_00_000000_000075,1whXJLCrTjY_0__668dbcdc,running a marathon knocked her out,when a marathon not a sprint,when:ins a:ok marathon:ok not:ins a:rep sprint:ins,66.7,66.7,33.3,50.0,40.0,"knocked, running"
2HddWQse8Mw_0__8ecb0409_00_000000_000072,2HddWQse8Mw_0__8ecb0409,james and will talk about street photography and other,some people want to talk about doing it in photography and other,some:ins people:ins want:ins to:ins talk:rep about:rep doing:ins it:ins in:ins photography:rep and:rep other:rep,77.8,50.0,0.0,100.0,0.0,james
2JuBrr6TW8o_14__39750242_00_000000_000112,2JuBrr6TW8o_14__39750242,they have something like this for the viola,some english for you all and,some:ins english:ins for:rep you:ins all:ins and:ins,100.0,90.0,0.0,0.0,0.0,"have, viola"
2S0wKsrQYqI_1__fbb354d6_00_000000_000141,2S0wKsrQYqI_1__fbb354d6,lures all with punch out hooks that go along with it this is no bigger than a credit card guys,is one of the largest oil reservoirs in the world there's no better place to drill a gas,is:rep one:ins of:ins the:ins largest:ins oil:ins reservoirs:ins in:ins the:ins world:ins there's:ins no:rep better:ins place:ins to:ins drill:ins a:ok gas:ins,95.0,155.2,0.0,0.0,0.0,"bigger, card, credit, go, guys, hooks, lures, no, punch"
3PE65tkpaGw_0__dde8ee01_00_000000_000291,3PE65tkpaGw_0__dde8ee01,i bought a custom well not a custom this is off the shelf but it's much more expensive router bit meant to do this exact operation,they're putting on a costume well our costumes of the show but it's much more expansive around being meant to do this exact operation,they're:ins putting:ins on:ins a:rep costume:ins well:rep our:ins costumes:ins of:ins the:rep show:ins but:rep it's:rep much:rep more:rep expansive:ins around:ins being:ins meant:rep to:rep do:rep this:rep exact:rep operation:rep,53.8,55.0,50.0,54.5,52.2,"bit, bought, custom, expensive, router, shelf"
3Sd87aIMr3k_15__19014265_00_000000_000090,3Sd87aIMr3k_15__19014265,now let's fill in the punnet square,to feel like the monkey square for the,to:ins feel:ins like:ins the:rep monkey:ins square:rep for:ins the:rep,100.0,106.7,0.0,100.0,0.0,punnet
48mil-jr-Pk_6__7aead1f5_00_000000_000073,48mil-jr-Pk_6__7aead1f5,for example wellness programs are very popular among employers,example wellness programs are very popular among employers,example:rep wellness:rep programs:rep are:rep very:rep popular:rep among:rep employers:rep,11.1,6.7,100.0,100.0,100.0,
5RJU2GoOvoM_0__d181c4ad_00_000000_000086,5RJU2GoOvoM_0__d181c4ad,you've got to get back up again because we all fall we all fail,you've got to get back up again because we all fall we all fail,you've:ok got:ok to:ok get:ok back:ok up:ok again:ok because:ok we:ok all:ok fall:ok we:ok all:ok fail:ok,0.0,9.5,100.0,100.0,100.0,
6j5IucNv9kc_8__7730cf1d_00_000000_000128,6j5IucNv9kc_8__7730cf1d,gadget mouse making company and they have this app on the app store you can pick up for free,excited to watch it come and then after that we're going to,excited:ins to:ins watch:ins it:ins come:ins and:rep then:ins after:ins that:ins we're:ins going:ins to:ins,100.0,97.0,0.0,100.0,0.0,"gadget, mouse"
6k4CVRuJ9tg_2__3bf717e1_00_000000_000223,6k4CVRuJ9tg_2__3bf717e1,again before i get into that i just want to check in with people i know that a couple people well a few people will probably hear live so feel free to go and check them out and if you're interested in learning more about the,the day before i get here i just want to check in with people i know that a couple of people are probably alive so i feel free to,the:rep day:ins before:rep i:rep get:rep here:ins i:ok just:ok want:ok to:ok check:ok in:ok with:ok people:ok i:ok know:ok that:ok a:ok couple:ok of:ins people:rep are:ins probably:rep alive:ins so:rep i:rep feel:rep free:rep to:rep,56.5,57.1,55.0,73.3,62.9,"again, few, go, hear, interested, learning, live, more, well"
8HA9Q9Ityfg_0__7a8ea09b_00_000000_000073,8HA9Q9Ityfg_0__7a8ea09b,own rail system for a few bucks,system for a few years now,system:rep for:rep a:rep few:rep years:ins now:ins,57.1,50.0,40.0,40.0,40.0,"bucks, own, rail"
8fk-CwhmumA_18__17792c60_00_000000_000129,8fk-CwhmumA_18__17792c60,as our routing and switching workbooks so that's why it's taking so long,i think it's a very exciting time to be an entrepreneur because the world is changing so fast,i:ins think:ins it's:rep a:ins very:ins exciting:ins time:ins to:ins be:ins an:ins entrepreneur:ins because:ins the:ins world:ins is:ins changing:ins so:rep fast:ins,130.8,95.2,16.7,11.1,13.3,"long, routing, switching, taking, workbooks"
8wCA1Phnc-I_0__20258a80_00_000000_000291,8wCA1Phnc-I_0__20258a80,to have at least 10 of the active ingredient protodiocin which is one of the steroidal glycosides that is in tribulus,at least 10 percent of the active ingredient prototypes which in this world is considered to be a good,at:rep least:rep 10:rep percent:ins of:rep the:rep active:rep ingredient:rep prototypes:ins which:rep in:rep this:ins world:ins is:rep considered:ins to:rep be:ins a:ins good:ins,66.7,77.8,50.0,25.0,33.3,one
91tFHYm9qso_7__03173d80_00_000000_000146,91tFHYm9qso_7__03173d80,so we started looking at the structure of coping and the structure of emotion and started really looking at,we started looking at structure of hope and the structure of emotion and started really looking,we:rep started:rep looking:rep at:rep structure:rep of:rep hope:ins and:rep the:rep structure:rep of:rep emotion:rep and:rep started:rep really:rep looking:rep,21.1,20.7,71.4,83.3,76.9,"coping, so"
9KACXV-cW-4_0__724f88a1_00_000000_000072,9KACXV-cW-4_0__724f88a1,now those predictions i think,first belief is that,first:ins belief:ins is:ins that:ins,100.0,100.0,0.0,0.0,0.0,"now, predictions, think"
9otzlTbuNO0_7__3db3b926_00_000000_000262,9otzlTbuNO0_7__3db3b926,it will catalog what i'm doing here for delayed pressure urticaria today's appointment,will catalog what i'm doing for delaying breast cancer here's today's appointment,will:rep catalog:rep what:rep i'm:rep doing:rep for:rep delaying:ins breast:ins cancer:ins here's:ins today's:rep appointment:rep,46.2,66.7,50.0,100.0,66.7,urticaria
9wJY59NWNz8_16__33190f6c_00_000000_000220,9wJY59NWNz8_16__33190f6c,we all live in our yellow submarine,we want to live in our own private,we:ok want:ins to:ins live:rep in:rep our:rep own:ins private:ins,57.1,50.0,33.3,25.0,28.6,"submarine, yellow"
AZTouP7hMjw_0__1479eaae_00_000000_000136,AZTouP7hMjw_0__1479eaae,some limonene hash oil some d limonene hash oil,being an actor being an actress,being:ins an:ins actor:ins being:ins an:ins actress:ins,100.0,100.0,0.0,100.0,0.0,d
BVynmQr3cf8_0__0166130c_00_000000_000169,BVynmQr3cf8_0__0166130c,so i have two and a half of these size cups which is probably like the equivalent of,i have two and a half of these nice cups which is probably like the equivalent of,i:rep have:rep two:rep and:rep a:rep half:rep of:rep these:rep nice:ins cups:rep which:rep is:rep probably:rep like:rep the:rep equivalent:rep of:rep,11.1,11.1,100.0,100.0,100.0,
Cc85FcXkFBs_0__54a4c098_00_000000_000269,Cc85FcXkFBs_0__54a4c098,the pacific the new flagship model won't be a high powered beast if you're looking for 20 nanometer manufacturing and high bandwidth memory then the tonga isn't for you,civic the new flash chip might won't be a high power piece if you're looking for 20 nanometer manufacturing and a high bandwidth with memory then the target isn't for you,civic:ins the:rep new:rep flash:ins chip:ins might:ins won't:ok be:ok a:ok high:ok power:ins piece:ins if:ok you're:ok looking:ok for:ok 20:ok nanometer:ok manufacturing:ok and:ok a:rep high:rep bandwidth:rep with:ins memory:rep then:rep the:rep target:ins isn't:rep for:rep you:rep,34.5,48.1,50.0,100.0,66.7,pacific
Cp1eBaFIRFw_1__e302e4f7_00_000000_000213,Cp1eBaFIRFw_1__e302e4f7,you could be using that way in here so that's basically my recipe i'm going to show you what we're going to do now,all about owning that right here so that's basically what i'm trying to do with what i do have,all:ins about:ins owning:ins that:rep right:ins here:rep so:rep that's:rep basically:rep what:rep i'm:rep trying:ins to:rep do:rep with:ins what:rep i:ins do:rep have:ins,62.5,71.8,36.4,50.0,42.1,"going, in, now, recipe, show, using, way"
DBhaa45mAro_2__07d05c7a_00_000000_000359,DBhaa45mAro_2__07d05c7a - Part 1,hey it's me just doing the eush keeping up with what's going on in school so here's the latest taylor and rob over brittany over dennis and julia totes over,hi it's me jessica dude who's keeping up with what's going on in the world to whom i owe the latest tailor rabbi over brady over ladies and julia toes over,hi:ins it's:ok me:ok jessica:ins dude:ins who's:ins keeping:rep up:rep with:rep what's:rep going:rep on:rep in:rep the:rep world:ins to:ins whom:ins i:ins owe:ins the:rep latest:rep tailor:ins rabbi:ins over:rep brady:ins over:rep ladies:ins and:rep julia:rep toes:ins over:rep,56.7,63.0,0.0,0.0,0.0,"dennis, julia, taylor"
DBhaa45mAro_2__07d05c7a_01_000299_000408,DBhaa45mAro_2__07d05c7a - Part 2,and julia totes over well thank god,julia child over real the,julia:rep child:ins over:rep real:ins the:ins,71.4,68.8,50.0,100.0,66.7,god
DUJbZV6oIds_0__55300c6c_00_000000_000287,DUJbZV6oIds_0__55300c6c - Part 1,second thing is a circular polarizer great for obviously exterior shooting but also good for getting rid of reflections sometimes in windows and things like that,second is i stoke the polarizer great for obviously hate shooting but also good for getting rid of reflections sometimes in windows and things like glass,second:ok is:rep i:ins stoke:ins the:ins polarizer:ok great:ok for:ok obviously:ok hate:ins shooting:ok but:ok also:ok good:ok for:ok getting:ok rid:ok of:ok reflections:ok sometimes:ok in:ok windows:ok and:ok things:ok like:ok glass:ins,23.1,19.5,80.0,80.0,80.0,"circular, exterior, thing"
DUJbZV6oIds_0__55300c6c_01_000239_000298,DUJbZV6oIds_0__55300c6c - Part 2,in windows and things like that,windows instead of glass to,windows:rep instead:ins of:ins glass:ins to:ins,83.3,75.0,50.0,33.3,40.0,things
DYZKgzvPexU_0__ad4114ab_00_000000_000073,DYZKgzvPexU_0__ad4114ab,hey how's it going youtube i'm 5'6 and i'm here to,and it's clear that viruses are here with us,and:rep it's:ins clear:ins that:ins viruses:ins are:ins here:rep with:ins us:ins,100.0,85.0,0.0,100.0,0.0,5'6
ECIwBVJ8cZQ_2__12e63349_00_000000_000122,ECIwBVJ8cZQ_2__12e63349,will not have enough food for a healthy life,we learned to have enough food for a healthy life,we:ins learned:ins to:ins have:rep enough:rep food:rep for:rep a:rep healthy:rep life:rep,33.3,14.3,100.0,83.3,90.9,
EG9HNZm6qSs_1__6a00dc91_00_000000_000101,EG9HNZm6qSs_1__6a00dc91,what you mean this the lapel mic i don't understand what's distracting about it,what do you mean this is the libelous i don't understand what she's ranting about it,what:ok do:ins you:rep mean:rep this:rep is:ins the:rep libelous:ins i:rep don't:rep understand:rep what:rep she's:ins ranting:ins about:rep it:rep,50.0,61.9,40.0,50.0,44.4,"distracting, lapel, mic"
F-2k62XeAvM_20__9237e7c5_00_000000_000191,F-2k62XeAvM_20__9237e7c5,but when we first started this series i wondered if we'd actually get through it you know all great ideas,when we first started this series i wondered if we'd actually get through it you know all great ideas,when:rep we:rep first:rep started:rep this:rep series:rep i:rep wondered:rep if:rep we'd:rep actually:rep get:rep through:rep it:rep you:rep know:rep all:rep great:rep ideas:rep,5.0,10.0,100.0,100.0,100.0,
FD9U2sgqJe8_16__9d9045c8_00_000000_000264,FD9U2sgqJe8_16__9d9045c8,i'm not sure if you're aware of it but yes there has been a class action suit filed against apple for that very thing and yes technically speaking it wasn't a wine it was a beer,i'm not sure if you're aware of it but yes there has been a class action student filed a lawsuit for that very thing and yes now technically speaking it wasn't a wine it was a beer,i'm:ok not:ok sure:ok if:ok you're:ok aware:ok of:ok it:ok but:ok yes:ok there:ok has:ok been:ok a:ok class:ok action:ok student:ins filed:ok a:rep lawsuit:ins for:ok that:ok very:ok thing:ok and:ok yes:ok now:ins technically:rep speaking:rep it:rep wasn't:rep a:rep wine:rep it:rep was:rep a:rep beer:rep,11.1,25.0,84.6,78.6,81.5,"apple, suit"
GwBfUzPCiaw_0__4d2b0fdb_00_000000_000164,GwBfUzPCiaw_0__4d2b0fdb,where is the car wo ist das auto,where is the car full is dusty outdoors,where:ok is:ok the:ok car:ok full:ins is:rep dusty:ins outdoors:ins,50.0,64.3,0.0,100.0,0.0,das
HhkhkWkzNP4_7__2527cbb1_00_000000_000256,HhkhkWkzNP4_7__2527cbb1,we're excited about several innovations that will deliver increased nutritional benefits of the food that we eat as well and also that will help ensure,time and money for several innovations that will yield increased nutritional benefit for the future well being of israel also they will help us secure,time:ins and:rep money:ins for:ins several:rep innovations:rep that:rep will:rep yield:ins increased:rep nutritional:rep benefit:ins for:ins the:rep future:ins well:rep being:ins of:rep israel:ins also:rep they:ins will:rep help:rep us:ins secure:ins,68.0,60.0,42.9,42.9,42.9,"as, benefits, deliver, eat, ensure, excited, food, well"
IQT8XQ9ODcY_11__d07f81fa_00_000000_000105,IQT8XQ9ODcY_11__d07f81fa,so you can update the spreadsheet from autocad,you're going to get dated especially from other guys,you're:ins going:ins to:ins get:ins dated:ins especially:ins from:ok other:ins guys:ins,100.0,91.7,0.0,0.0,0.0,"autocad, so, spreadsheet, update"
JJRxStrOiBI_7__24d99a07_00_000000_000151,JJRxStrOiBI_7__24d99a07,for that you will use preter because that's what happened what people did,for that you will lose what has happened or people that will,for:ok that:ok you:ok will:ok lose:ins what:rep has:ins happened:rep or:ins people:rep that:rep will:rep,61.5,73.7,40.0,66.7,50.0,"did, preter, use"
K0h33Ps7vz4_11__e66d3063_00_000000_000103,K0h33Ps7vz4_11__e66d3063,to this wave of artificial intelligence that is slowly taking place,to this wave of artificial intelligence that is slowly taking place,to:ok this:ok wave:ok of:ok artificial:ok intelligence:ok that:ok is:ok slowly:ok taking:ok place:ok,0.0,0.0,100.0,100.0,100.0,
LGcjzM3BX-s_3__cc3e230e_00_000000_000154,LGcjzM3BX-s_3__cc3e230e,they do however on again they do however hold the festival,they don't know how awful it is to tell you how awful your face looks,they:ok don't:ins know:ins how:ins awful:ins it:ins is:ins to:ins tell:ins you:ins how:ins awful:ins your:ins face:ins looks:ins,127.3,94.4,0.0,0.0,0.0,"again, do, festival, hold, however, on"
MO4hiiayz3w_9__e89a45de_00_000000_000139,MO4hiiayz3w_9__e89a45de,it's not bad you know what because it's our culture it's our culture you have to,not a bad word because it's our culture our culture is our,not:rep a:ins bad:ok word:ins because:rep it's:rep our:rep culture:rep our:ok culture:ok is:ins our:ok,56.2,66.7,50.0,66.7,57.1,"have, know"
NGCTGBsuEg4_20__f35e3151_00_000000_000195,NGCTGBsuEg4_20__f35e3151,vi we said was zero so that goes away so vf is f delta t,v i would say we're zero so that goes away so v i have the lead staff to tell the team,v:ins i:ins would:ins say:ins we're:ins zero:rep so:rep that:rep goes:rep away:rep so:rep v:ins i:ins have:ins the:ins lead:ins staff:ins to:ins tell:ins the:ins team:ins,100.0,62.5,25.0,100.0,40.0,"delta, f, t"
OxenfkPpJPY_0__0f9d64b8_00_000000_000221,OxenfkPpJPY_0__0f9d64b8,if police reasonably believe that you have information that could assist them with the investigation of a serious offence then you have to give them your name and address,police reasonably believe that you have information that could assist them with the investigation of a serious offence then you have to give them your name and address,police:rep reasonably:rep believe:rep that:rep you:rep have:rep information:rep that:rep could:rep assist:rep them:rep with:rep the:rep investigation:rep of:rep a:rep serious:rep offence:rep then:rep you:rep have:rep to:rep give:rep them:rep your:rep name:rep and:rep address:rep,3.4,2.3,100.0,100.0,100.0,
PSJRmPfOGYQ_13__b2afc3d9_00_000000_000122,PSJRmPfOGYQ_13__b2afc3d9,i see twitter feeds all over the place right i see them in news stories i see them in,see green fins all over the place so i can see them close to shore i see them in the,see:rep green:ins fins:ins all:rep over:rep the:rep place:rep so:ins i:rep can:ins see:ok them:ok close:ins to:ins shore:ins i:ok see:ok them:ok in:ok the:rep,47.4,53.6,42.9,42.9,42.9,"feeds, news, stories, twitter"
QvDw6m2kA6Q_0__a756b252_00_000000_000129,QvDw6m2kA6Q_0__a756b252,there are two types of teeth the first type is the anus,those two times i've seen the first time is in kenya,those:ins two:rep times:ins i've:ins seen:ins the:rep first:rep time:ins is:rep in:ins kenya:ins,66.7,61.9,100.0,50.0,66.7,
QzYx9bYHxKo_3__373a7e56_00_000000_000091,QzYx9bYHxKo_3__373a7e56,this book ain't just narrated by one fool tellin us what's up with the dun,speak english as i say right about watermelons that's what's up with that,speak:ins english:ins as:ins i:ins say:ins right:ins about:ins watermelons:ins that's:ins what's:rep up:rep with:rep that:ins,80.0,90.6,0.0,0.0,0.0,"one, tellin, us"
RsPPOL9XhcM_14__da966181_00_000000_000321,RsPPOL9XhcM_14__da966181,goes on to say frank sachs lead author on the report said he has no idea why people think coconut oil is healthy it's almost 100 fat he says,goes on to say france as the lead author on the report said he has no idea why people think going north is south it's almost 100 percent fat kills us,goes:ok on:ok to:ok say:ok france:ins as:ins the:rep lead:rep author:rep on:rep the:rep report:rep said:rep he:rep has:rep no:rep idea:rep why:rep people:rep think:rep going:ins north:ins is:rep south:ins it's:rep almost:rep 100:rep percent:ins fat:rep kills:ins us:ins,31.0,33.3,100.0,25.0,40.0,
S0ID6pdAvvY_7__e2281119_00_000000_000214,S0ID6pdAvvY_7__e2281119,with how to reverse it okay what are the handful of things i'm gonna show you some things that might help you here in just a minute,just reverse it like what is the handful of things i'm going to show you some things like my belt loop or something like that but,just:rep reverse:rep it:rep like:ins what:rep is:ins the:rep handful:rep of:rep things:rep i'm:rep going:ins to:rep show:rep you:rep some:rep things:rep like:ins my:ins belt:ins loop:ins or:ins something:ins like:ins that:rep but:ins,59.3,93.5,0.0,100.0,0.0,"a, just, minute"
S8aXVz799Dc_7__0af934d2_00_000000_000204,S8aXVz799Dc_7__0af934d2,another useful expression i'm afraid there's been a mistake or i'm afraid there's been a mistake,another useful expression i'm afraid there's been a mishap or i m afraid there s,another:ok useful:ok expression:ok i'm:ok afraid:ok there's:ok been:ok a:ok mishap:ins or:ok i:ins m:ins afraid:rep there:ins s:ins,43.8,117.9,80.0,57.1,66.7,mistake
SQONLdb1gow_3__82d6e002_00_000000_000088,SQONLdb1gow_3__82d6e002,in the case of exercise it's not just a matter of working or not working,days of exercise is not just a matter of working or not working,days:ins of:rep exercise:rep is:ins not:rep just:rep a:rep matter:rep of:rep working:rep or:rep not:rep working:rep,26.7,27.3,80.0,80.0,80.0,case
SmTednDfdxA_8__7fc8688e_00_000000_000090,SmTednDfdxA_8__7fc8688e,and so what are the arguments that the individual mandate,and so what are the arguments that the individual may take,and:ok so:ok what:ok are:ok the:ok arguments:ok that:ok the:ok individual:ok may:ins take:ins,20.0,14.3,75.0,75.0,75.0,mandate
TgdqxHIF-Ec_1__b8b5e460_00_000000_000108,TgdqxHIF-Ec_1__b8b5e460,but i have to understand in my head what that looks like in 3d as i'm drawing it,but i feel like this side of my head what that looks like in the real world as i'm drawing,but:ok i:ok feel:ins like:rep this:ins side:ins of:ins my:rep head:rep what:rep that:rep looks:rep like:rep in:rep the:ins real:ins world:ins as:rep i'm:rep drawing:rep,50.0,44.0,50.0,42.9,46.2,"3d, have, understand"
TuUiNhbMzjY_8__8b4a8fec_00_000000_000091,TuUiNhbMzjY_8__8b4a8fec,one really nice thing about this is,what a brilliant idea this is,what:ins a:ins brilliant:ins idea:ins this:rep is:rep,71.4,84.6,0.0,100.0,0.0,one
VI-3EHJ-2pI_1__e8f492eb_00_000000_000090,VI-3EHJ-2pI_1__e8f492eb,do is either sit or stand the baby up on a chair,either standing or sitting the baby up on a chair,either:rep standing:ins or:rep sitting:ins the:rep baby:rep up:rep on:rep a:rep chair:rep,33.3,37.5,50.0,50.0,50.0,"sit, stand"
VMWNq9cCXU4_12__451829a4_00_000000_000185,VMWNq9cCXU4_12__451829a4,cartoon characters the blue and the red those things change all the time on influenza which is why we have to re evaluate,are too tightly coupled with the rate those things change all the time influencing which is why we have to reach,are:ins too:ins tightly:ins coupled:ins with:ins the:ok rate:ins those:ok things:ok change:ok all:ok the:ok time:ok influencing:ins which:rep is:rep why:rep we:rep have:rep to:rep reach:ins,43.5,48.5,40.0,40.0,40.0,"blue, cartoon, characters, evaluate, influenza, red"
VxZ2o9MPtFA_24__390f4eae_00_000000_000278,VxZ2o9MPtFA_24__390f4eae,what we call business development training in other words they taught me how to sell they taught me a little bit about the product,what are business development training in other words that taught me how to sell they taught me a little bit about how to about the product,what:ok are:ins business:rep development:rep training:rep in:rep other:rep words:rep that:ins taught:rep me:rep how:rep to:rep sell:rep they:rep taught:rep me:rep a:rep little:rep bit:rep about:rep how:rep to:rep about:rep the:rep product:rep,25.0,27.8,90.9,100.0,95.2,call
WNDj1BAKi0A_0__49b21410_00_000000_000194,WNDj1BAKi0A_0__49b21410,we will give up some of our individual choice for the sake of the community decision,will give up some of our individual choices for the sake of the community and,will:rep give:rep up:rep some:rep of:rep our:rep individual:rep choices:ins for:rep the:rep sake:rep of:rep the:rep community:rep and:ins,18.8,22.7,66.7,80.0,72.7,"choice, decision"
WRtKKFMhJVM_4__91456207_00_000000_000355,WRtKKFMhJVM_4__91456207,would give you are the 16 but the lines are straight so either lens correction was used or it's just really freaking straight or cropped or whatever but it looks great with the stands the crowd the lights look awesome,some of the deforestation that's occurring in asia is due to the extraction of timber for free trade timber illegally harvested timber will have murky origins so it's hard to trace the cause but,some:ins of:ins the:rep deforestation:ins that's:ins occurring:ins in:ins asia:ins is:ins due:ins to:ins the:rep extraction:ins of:ins timber:ins for:ins free:ins trade:ins timber:ins illegally:ins harvested:ins timber:ins will:ins have:ins murky:ins origins:ins so:rep it's:rep hard:ins to:ins trace:ins the:rep cause:ins but:rep,95.0,96.8,0.0,0.0,0.0,16
